{
  "$schema": "http://json-schema.org/draft-07/schema#",
  "$id": "https://docs.github.com/gh-aw/schemas/wizard-data-model.schema.json",
  "title": "Agentic Workflow Wizard Data Model",
  "description": "Reusable JSON data model that drives the WHAT \u2192 WHEN \u2192 WHERE \u2192 task-details wizard flow described in the Wizard Data Model Specification v1.0.0. This shape is intentionally decoupled from any Astro/UI-specific behavior so it can be reused by a future `gh aw` CLI consumer.",
  "type": "object",
  "required": ["version", "goalCategories", "triggerOptions", "destinationOptions"],
  "additionalProperties": false,
  "properties": {
    "version": {
      "type": "string",
      "description": "Additive schema version for this data model, following semver (MAJOR.MINOR.PATCH). Consumers MUST tolerate unknown additional fields within a MAJOR version.",
      "pattern": "^\\d+\\.\\d+\\.\\d+$",
      "examples": ["1.0.0"]
    },
    "goalCategories": {
      "type": "array",
      "description": "WHAT step: known high-level goals a user might choose from. Each category declares which trigger options and destination options are compatible, enabling conditional progression without embedding presentation logic.",
      "minItems": 1,
      "items": { "$ref": "#/definitions/goalCategory" }
    },
    "triggerOptions": {
      "type": "array",
      "description": "WHEN step: catalog of available trigger configurations (schedule, event, slash command, manual dispatch, etc.) that a goal category can reference by id.",
      "minItems": 1,
      "items": { "$ref": "#/definitions/triggerOption" }
    },
    "destinationOptions": {
      "type": "array",
      "description": "WHERE step: catalog of safe-output destinations (e.g. create-issue, add-comment, create-pull-request) with inference hints so the wizard can pre-select a likely destination based on prior answers.",
      "minItems": 1,
      "items": { "$ref": "#/definitions/destinationOption" }
    },
    "promptTemplate": {
      "$ref": "#/definitions/promptTemplate",
      "description": "Optional fields describing how collected answers are assembled into the final, self-contained prompt text presented to the user."
    }
  },
  "definitions": {
    "localizedText": {
      "type": "object",
      "description": "Minimal presentation metadata for a label/help pair. Kept intentionally small so behavior/content stay portable across UI implementations.",
      "required": ["label"],
      "additionalProperties": false,
      "properties": {
        "label": {
          "type": "string",
          "description": "Short, user-facing label.",
          "minLength": 1
        },
        "help": {
          "type": "string",
          "description": "Optional longer help/description text shown alongside the label."
        }
      }
    },
    "goalCategory": {
      "type": "object",
      "description": "A single WHAT-step option. Explicit `id` is the stable key; never key data structures by free-form label text.",
      "required": ["id", "text", "triggerOptionIds", "destinationOptionIds"],
      "additionalProperties": false,
      "properties": {
        "id": {
          "type": "string",
          "description": "Stable, unique identifier for this goal category. MUST NOT change across versions once published.",
          "pattern": "^[a-z][a-z0-9-]*$",
          "examples": ["ci-triage", "issue-automation", "scheduled-report"]
        },
        "text": { "$ref": "#/definitions/localizedText" },
        "triggerOptionIds": {
          "type": "array",
          "description": "IDs (from `triggerOptions`) that are valid/recommended follow-up choices for the WHEN step when this goal is selected.",
          "minItems": 1,
          "items": { "type": "string" }
        },
        "destinationOptionIds": {
          "type": "array",
          "description": "IDs (from `destinationOptions`) that are valid/recommended follow-up choices for the WHERE step when this goal is selected.",
          "minItems": 1,
          "items": { "type": "string" }
        },
        "defaultTriggerOptionId": {
          "type": "string",
          "description": "Optional id of the trigger option to pre-select/infer for this goal, from `triggerOptionIds`."
        },
        "defaultDestinationOptionId": {
          "type": "string",
          "description": "Optional id of the destination option to pre-select/infer for this goal, from `destinationOptionIds`."
        }
      }
    },
    "triggerOption": {
      "type": "object",
      "description": "A single WHEN-step option describing one GitHub Actions trigger shape supported by gh-aw.",
      "required": ["id", "type", "text"],
      "additionalProperties": false,
      "properties": {
        "id": {
          "type": "string",
          "description": "Stable, unique identifier for this trigger option.",
          "pattern": "^[a-z][a-z0-9-]*$",
          "examples": ["schedule-daily", "on-issue-opened", "slash-command", "manual-dispatch"]
        },
        "type": {
          "type": "string",
          "description": "Underlying gh-aw/GitHub Actions trigger category this option maps to.",
          "enum": ["schedule", "issues", "pull_request", "discussion", "issue_comment", "workflow_dispatch", "slash_command", "push", "other"]
        },
        "text": { "$ref": "#/definitions/localizedText" },
        "frontmatter": {
          "type": "object",
          "description": "Optional literal (or template) fragment of gh-aw workflow frontmatter `on:` configuration this option contributes, e.g. `{\"schedule\": \"daily\"}`. Kept as free-form object because shapes vary by trigger type; the future CLI consumer is expected to merge this fragment as-is.",
          "additionalProperties": true
        }
      }
    },
    "destinationOption": {
      "type": "object",
      "description": "A single WHERE-step option describing one safe-output destination.",
      "required": ["id", "safeOutputType", "text"],
      "additionalProperties": false,
      "properties": {
        "id": {
          "type": "string",
          "description": "Stable, unique identifier for this destination option.",
          "pattern": "^[a-z][a-z0-9-]*$",
          "examples": ["comment-on-issue", "open-pull-request", "create-discussion"]
        },
        "safeOutputType": {
          "type": "string",
          "description": "Name of the corresponding gh-aw safe-outputs handler key (see safe-outputs frontmatter, e.g. 'add-comment', 'create-issue', 'create-pull-request').",
          "minLength": 1
        },
        "text": { "$ref": "#/definitions/localizedText" },
        "inferFromTriggerTypes": {
          "type": "array",
          "description": "Optional list of trigger `type` values (from `triggerOption.type`) that this destination is automatically inferred/recommended for, so the WHERE step can be skipped or pre-answered.",
          "items": { "type": "string" }
        },
        "frontmatter": {
          "type": "object",
          "description": "Optional literal (or template) fragment of gh-aw workflow frontmatter `safe-outputs:` configuration this option contributes.",
          "additionalProperties": true
        }
      }
    },
    "promptTemplate": {
      "type": "object",
      "description": "Fields controlling how the final, self-contained generation prompt is assembled from collected wizard answers. The rendered prompt MUST NOT assume any prior installation/setup by the user.",
      "additionalProperties": false,
      "properties": {
        "introText": {
          "type": "string",
          "description": "Fixed opening text prepended to the generated prompt, establishing context for the target AI/CLI consumer."
        },
        "sections": {
          "type": "array",
          "description": "Ordered list of named sections used to assemble the final prompt (e.g. goal, trigger, destination, task-details).",
          "items": {
            "type": "object",
            "required": ["id", "heading"],
            "additionalProperties": false,
            "properties": {
              "id": {
                "type": "string",
                "description": "Stable identifier for this prompt section.",
                "pattern": "^[a-z][a-z0-9-]*$"
              },
              "heading": {
                "type": "string",
                "description": "Heading/label rendered above this section's content in the assembled prompt."
              }
            }
          }
        }
      }
    }
  }
}
