{
  "$schema": "https://docs.github.com/gh-aw/schemas/wizard-data-model.schema.json",
  "version": "1.0.0",
  "goalCategories": [
    {
      "id": "issue-automation",
      "text": {
        "label": "Automate issue triage or replies",
        "help": "Respond to, label, or triage issues automatically when they are opened or commented on."
      },
      "triggerOptionIds": ["on-issue-opened", "slash-command", "on-issue-comment"],
      "destinationOptionIds": ["comment-on-issue", "add-labels-to-issue"],
      "defaultTriggerOptionId": "on-issue-opened",
      "defaultDestinationOptionId": "comment-on-issue"
    },
    {
      "id": "scheduled-report",
      "text": {
        "label": "Generate a recurring report",
        "help": "Run on a schedule and publish a summary, digest, or status report."
      },
      "triggerOptionIds": ["schedule-daily", "schedule-weekly", "manual-dispatch"],
      "destinationOptionIds": ["create-discussion", "open-pull-request"],
      "defaultTriggerOptionId": "schedule-daily",
      "defaultDestinationOptionId": "create-discussion"
    },
    {
      "id": "pr-review-assistant",
      "text": {
        "label": "Review pull requests automatically",
        "help": "Review incoming pull requests and leave feedback or suggested fixes."
      },
      "triggerOptionIds": ["on-pull-request", "slash-command"],
      "destinationOptionIds": ["comment-on-issue", "open-pull-request"],
      "defaultTriggerOptionId": "on-pull-request",
      "defaultDestinationOptionId": "comment-on-issue"
    }
  ],
  "triggerOptions": [
    {
      "id": "on-issue-opened",
      "type": "issues",
      "text": { "label": "When an issue is opened", "help": "Fires whenever a new issue is created." },
      "frontmatter": { "on": { "issues": { "types": ["opened"] } } }
    },
    {
      "id": "on-issue-comment",
      "type": "issue_comment",
      "text": { "label": "When someone comments on an issue" },
      "frontmatter": { "on": { "issue_comment": { "types": ["created"] } } }
    },
    {
      "id": "on-pull-request",
      "type": "pull_request",
      "text": { "label": "When a pull request is opened or updated" },
      "frontmatter": { "on": { "pull_request": { "types": ["opened", "synchronize"] } } }
    },
    {
      "id": "slash-command",
      "type": "slash_command",
      "text": { "label": "When triggered by a /command comment", "help": "Runs on-demand when a user comments a slash command." },
      "frontmatter": { "on": "/my-bot" }
    },
    {
      "id": "schedule-daily",
      "type": "schedule",
      "text": { "label": "Every day" },
      "frontmatter": { "on": { "schedule": "daily" } }
    },
    {
      "id": "schedule-weekly",
      "type": "schedule",
      "text": { "label": "Every week" },
      "frontmatter": { "on": { "schedule": "weekly" } }
    },
    {
      "id": "manual-dispatch",
      "type": "workflow_dispatch",
      "text": { "label": "Only when run manually" },
      "frontmatter": { "on": "workflow_dispatch" }
    }
  ],
  "destinationOptions": [
    {
      "id": "comment-on-issue",
      "safeOutputType": "add-comment",
      "text": { "label": "Post a comment" },
      "inferFromTriggerTypes": ["issues", "issue_comment", "pull_request"]
    },
    {
      "id": "add-labels-to-issue",
      "safeOutputType": "add-labels",
      "text": { "label": "Add labels" },
      "inferFromTriggerTypes": ["issues"]
    },
    {
      "id": "open-pull-request",
      "safeOutputType": "create-pull-request",
      "text": { "label": "Open a pull request" },
      "inferFromTriggerTypes": ["schedule", "pull_request", "workflow_dispatch"]
    },
    {
      "id": "create-discussion",
      "safeOutputType": "create-discussion",
      "text": { "label": "Post a discussion" },
      "inferFromTriggerTypes": ["schedule", "workflow_dispatch"]
    }
  ],
  "promptTemplate": {
    "introText": "You are helping generate a new GitHub Agentic Workflow (gh-aw) markdown file. This prompt is self-contained: run it in your project with an AI coding assistant and it will produce a complete `.md` workflow without assuming any prior gh-aw setup.",
    "sections": [
      { "id": "goal", "heading": "Goal" },
      { "id": "trigger", "heading": "Trigger" },
      { "id": "destination", "heading": "Output destination" },
      { "id": "task-details", "heading": "Task details" }
    ]
  }
}
